{
  "format": "rezeptplaner-import",
  "version": 2,
  "generator": "claude-skill rezeptplaner-import 2.1",
  "recipes": [
    {
      "title": "Gnocchi-Pfanne mit Spinat und Tomaten",
      "description": "Knusprig gebratene Gnocchi in cremiger Tomatensoße mit frischem Spinat.",
      "base_servings": 2,
      "prep_minutes": 10,
      "total_minutes": 25,
      "source": { "name": "HelloFresh-Karte" },
      "notes": "Unsicher: Menge der Sahne auf der Karte schlecht lesbar (vermutlich 100 ml), daher ohne Menge erfasst.",
      "categories": ["Vegetarisch", "Herzhaft", "Pfanne", "Schnell"],
      "image": "images/01-gnocchi-pfanne-mit-spinat-und-tomaten.jpg",
      "image_kind": "photo",
      "ingredients": [
        { "quantity": 400, "unit": "g", "name": "Gnocchi" },
        { "quantity": 1, "unit": "Stück", "name": "Zwiebel" },
        { "quantity": 1, "unit": "Zehe", "name": "Knoblauch" },
        { "quantity": 250, "unit": "g", "name": "Cherrytomaten" },
        { "quantity": 100, "unit": "g", "name": "Babyspinat" },
        { "quantity": null, "unit": "", "name": "Sahne", "note": "Menge unleserlich" },
        { "quantity": 25, "unit": "g", "name": "Parmesan", "note": "gerieben" },
        { "group": "Aus deiner Vorratskammer", "quantity": 1, "unit": "EL", "name": "Olivenöl", "shopping_relevant": false },
        { "group": "Aus deiner Vorratskammer", "quantity": null, "unit": "", "name": "Salz", "note": "nach Geschmack", "shopping_relevant": false },
        { "group": "Aus deiner Vorratskammer", "quantity": null, "unit": "", "name": "Pfeffer", "note": "nach Geschmack", "shopping_relevant": false }
      ],
      "steps": [
        "Zwiebel und Knoblauch abziehen und fein würfeln. Cherrytomaten halbieren.",
        "Olivenöl in einer großen Pfanne erhitzen und die Gnocchi darin 5–6 Minuten goldbraun braten. Herausnehmen.",
        "Zwiebel und Knoblauch in derselben Pfanne 2 Minuten anschwitzen, Tomaten zugeben und 3 Minuten mitbraten.",
        "Sahne zugießen, Spinat unterheben und zusammenfallen lassen. Mit Salz und Pfeffer abschmecken.",
        "Gnocchi zurück in die Pfanne geben, alles vermengen und mit Parmesan bestreut servieren."
      ]
    },
    {
      "title": "Hähnchen-Curry mit Kokosmilch, Paprika und Reis",
      "base_servings": 4,
      "total_minutes": null,
      "source": { "name": "Handschriftlich" },
      "notes": "Titel automatisch vergeben (Vorlage ohne Titel). Portionen nicht angegeben, 4 angenommen. Bild ist eine Illustration (kein Foto vom Gericht).",
      "categories": ["Geflügel", "Herzhaft", "Reis", "Pfanne"],
      "image": "images/02-haehnchen-curry-mit-kokosmilch-paprika.jpg",
      "image_kind": "illustration",
      "ingredients": [
        { "quantity": 500, "unit": "g", "name": "Hähnchenbrust" },
        { "quantity": 1, "unit": "Dose", "name": "Kokosmilch" },
        { "quantity": 2, "unit": "EL", "name": "rote Currypaste" },
        { "quantity": 1, "unit": "Stück", "name": "Paprika", "note": "rot" },
        { "quantity": 1, "unit": "Stück", "name": "Zucchini" },
        { "quantity": 250, "unit": "g", "name": "Reis" },
        { "quantity": null, "unit": "", "name": "Öl", "note": "zum Anbraten", "shopping_relevant": false }
      ],
      "steps": [
        "Hähnchen würfeln und in Öl anbraten.",
        "Currypaste kurz mitbraten.",
        "Paprika und Zucchini zugeben, mit Kokosmilch ablöschen und 15 Minuten köcheln lassen.",
        "Mit Reis servieren."
      ]
    }
  ]
}
